{
  "schema_version": 3,
  "compatibility_state": "compatible",
  "generated_at": "2026-07-13T12:00:00Z",
  "repository": "minhuw/coquic",
  "main_branch": "main",
  "state": "working",
  "counts": {"tasks": 3, "active": 1, "queued": 0, "attention": 1, "completed": 2, "signals": 1, "pending_signals": 1},
  "runtime": {
    "instance_id": "steward-20260713T115500Z-a1b2c3d4",
    "started_at": "2026-07-13T11:55:00Z",
    "heartbeat_at": "2026-07-13T12:00:00Z",
    "state": "active",
    "current_cycle_started_at": "2026-07-13T11:59:45Z",
    "current_cycle_reason": "scheduler_wakeup",
    "last_completed_cycle": null,
    "heartbeat_interval_seconds": 30
  },
  "publication": {
    "state": "published",
    "snapshot_id": "1111111111111111111111111111111111111111111111111111111111111111",
    "generated_at": "2026-07-13T12:00:00Z",
    "last_attempt_at": "2026-07-13T12:00:01Z",
    "last_success_at": "2026-07-13T12:00:02Z",
    "last_failure_at": null,
    "last_failure_category": null,
    "retry_count": 0,
    "last_accepted_digest": "1111111111111111111111111111111111111111111111111111111111111111"
  },
  "tasks_truncated": false,
  "tasks": [
    {
      "id": "task-20260713115945-a1b2c3d4",
      "title": "Implement dashboard contract",
      "kind": "feature",
      "workflow": "feature",
      "worker": "feature-implementer",
      "priority": "high",
      "risk": "medium",
      "status": "running",
      "summary": "Worker is validating the public monitor",
      "source": "manual",
      "created_at": "2026-07-13T11:59:45Z",
      "updated_at": "2026-07-13T12:00:00Z",
      "detail_url": "/steward/tasks/task-20260713115945-a1b2c3d4",
      "detail_json": "/steward/data/tasks/task-20260713115945-a1b2c3d4.json",
      "validations": []
    },
    {
      "id": "task-20260713115800-b1c2d3e4",
      "title": "Review blocked task",
      "kind": "ci",
      "workflow": "fix",
      "worker": "ci-doctor",
      "priority": "medium",
      "risk": "low",
      "status": "blocked",
      "summary": "Review requires operator attention",
      "source": "signal",
      "created_at": "2026-07-13T11:58:00Z",
      "updated_at": "2026-07-13T11:59:30Z",
      "detail_url": "/steward/tasks/task-20260713115800-b1c2d3e4",
      "detail_json": "/steward/data/tasks/task-20260713115800-b1c2d3e4.json",
      "validations": [{"passed": false, "exit_code": 1, "summary": "Review was blocked", "iteration": 0, "started_at": "2026-07-13T11:59:00Z", "completed_at": "2026-07-13T11:59:30Z"}]
    },
    {
      "id": "task-20260713115700-c1d2e3f4",
      "title": "Integrate monitor contract",
      "kind": "integration",
      "workflow": "fix",
      "worker": "integration-manager",
      "priority": "low",
      "risk": "low",
      "status": "pushed",
      "summary": "pushed abcdef1234567890",
      "source": "integration",
      "created_at": "2026-07-13T11:57:00Z",
      "updated_at": "2026-07-13T11:58:00Z",
      "detail_url": "/steward/tasks/task-20260713115700-c1d2e3f4",
      "detail_json": "/steward/data/tasks/task-20260713115700-c1d2e3f4.json",
      "validations": [{"passed": true, "exit_code": 0, "summary": "Integration checks passed", "iteration": null, "started_at": "2026-07-13T11:57:30Z", "completed_at": "2026-07-13T11:58:00Z"}]
    }
  ],
  "signals": {
    "items_truncated": false,
    "fetches_truncated": false,
    "items": [{"id": "wi-contract-a1b2c3d4", "provider": "github-actions:ci", "kind": "workflow", "title": "Contract checks are running", "summary": "The monitor contract suite is active", "severity": "info", "status": "pending", "created_at": "2026-07-13T11:58:00Z", "updated_at": "2026-07-13T11:59:00Z", "planned_at": null, "planned_task_id": null, "links": []}],
    "fetches": [{"id": "signal-fetch-20260713115900-a1b2c3d4", "provider": "github-actions:ci", "status": "ok", "started_at": "2026-07-13T11:58:55Z", "completed_at": "2026-07-13T11:59:00Z", "item_count": 1, "new_item_count": 1, "has_more": false, "summary": "Fetched one active workflow", "error": null}],
    "summary": "1 signal item, 0 provider errors",
    "enabled_signals": ["github-actions:ci"]
  },
  "scheduler": {
    "source_active": 1,
    "source_capacity": 4,
    "source_queued": 0,
    "integration_active": 0,
    "integration_queued": 0,
    "pending_wakeups_truncated": false,
    "recent_wakeups_truncated": false,
    "pending_wakeups": [],
    "recent_wakeups": [],
    "providers": [{"provider": "github-actions:ci", "poll_interval_minutes": 30, "error_retry_minutes": 30, "idle_poll_interval_minutes": 30, "suppression_hours": 1, "max_items": 3, "last_fetch_at": "2026-07-13T11:59:00Z", "last_status": "ok", "last_error": null, "next_due_at": "2026-07-13T12:29:00Z", "idle_next_due_at": "2026-07-13T12:29:00Z", "due": false, "idle_due": false}]
  },
  "planner_runs_truncated": false,
  "planner_runs": [{
    "id": "planner-task-20260713115600-a1b2c3d4",
    "status": "succeeded",
    "started_at": "2026-07-13T11:56:00Z",
    "completed_at": "2026-07-13T11:56:30Z",
    "accepted_count": 1,
    "proposed_count": 2,
    "consumed_signal_ids": ["wi-contract-a1b2c3d4"],
    "diagnostics": {"summary": "Planner completed", "exit_code": 0, "error_category": "none", "last_message_present": true},
    "artifacts": {
      "transcript": {"availability": "available", "mode": "redacted", "text": "Planner completed", "size": 18, "size_bytes": 18, "original_size_bytes": 18, "truncated": false},
      "last_message": {"availability": "available", "mode": "redacted", "text": "One task accepted", "size": 18, "size_bytes": 18, "original_size_bytes": 18, "truncated": false}
    }
  }],
  "audit": [],
  "configuration": {"repository": "minhuw/coquic", "main_branch": "main", "integration_mode": "local-only", "local_only": true, "enabled_signals": ["github-actions:ci"], "scheduler_wait_interval_sec": 1.0, "limits": {"max_active_tasks": 4}, "signal_providers": {"github-actions:ci": {"poll_interval_minutes": 30, "error_retry_minutes": 30, "idle_poll_interval_minutes": 30, "suppression_hours": 1, "max_items": 3}}},
  "integration": {"active": [], "queue": [], "commits": [{"task_id": "task-20260713115700-c1d2e3f4", "title": "Integrate monitor contract", "status": "pushed", "summary": "pushed abcdef1234567890", "commit": "abcdef1234567890", "commit_url": "https://github.com/minhuw/coquic/commit/abcdef1234567890", "updated_at": "2026-07-13T11:58:00Z"}]}
}
